{
  "id": "EXP-000032",
  "title": "Asset rollback must restore metadata identity",
  "category": "failures",
  "task_type": "Unity Editor asset and build verification",
  "ai_system": "AI-assisted engineering and diagnosis",
  "observation_date": "2026-10-09",
  "environment": "Unity Editor generated assets. This is distinct from source-sync deletion risk and does not prove every filesystem or editor failure boundary.",
  "goal": "Roll back generated menu assets after a later build step fails.",
  "approach": "Historical failed assumption: An asset's payload bytes were treated as its complete transactional state.",
  "what_worked": "Historical correction: Snapshot and restore content and metadata before forced import; check transitive references after recovery. Verification reported by the source: An injected fault after generation/page deletion restored asset bytes, metadata bytes, GUID/local fileID and root dependencies. The historical validator passed its bounded rollback controls.",
  "what_failed": "Historical observed failure: Restoring serialized asset content alone lost metadata-backed reference identity after generated pages were deleted.",
  "why": "Confirmed source gap: rollback snapshots omitted .meta identity.",
  "improved_method": "Include identity metadata and reference graphs in asset snapshots. Inject failure after deletion and verify references, not just content equality.",
  "when_to_use": "Unity Editor generated assets. This is distinct from source-sync deletion risk and does not prove every filesystem or editor failure boundary.",
  "when_not_to_use": "This is distinct from source-sync deletion risk and does not prove every filesystem or editor failure boundary.",
  "known_limitations": "This is an independently curated generalization of an earlier recorded failure. No source-side experiment was rerun during this registration; observation_date is the 2026-10-09 knowledge-review date, not the incident date. Applicability and root-cause claims remain limited to the source-reported conditions.",
  "evidence_type": "direct experiment",
  "reproduction_status": "not reproduced",
  "confidence": "low",
  "related_knowledge_ids": [
    "EXP-000003"
  ],
  "safety_review": {
    "status": "approved",
    "independent_review": true,
    "data_minimization": true,
    "no_identifiers": true,
    "no_private_data": true,
    "rights_checked": true
  },
  "knowledge_status": "historical",
  "failure_details": {
    "failure": "Restoring serialized asset content alone lost metadata-backed reference identity after generated pages were deleted.",
    "impact": "The described historical operation or its acceptance evidence was affected; impact beyond the documented case was not established.",
    "cause": "Confirmed source gap: rollback snapshots omitted .meta identity.",
    "detection": "The historical record reports: An injected fault after generation/page deletion restored asset bytes, metadata bytes, GUID/local fileID and root dependencies. The historical validator passed its bounded rollback controls.",
    "recovery": "Snapshot and restore content and metadata before forced import; check transitive references after recovery.",
    "prevention": "Include identity metadata and reference graphs in asset snapshots. Inject failure after deletion and verify references, not just content equality.",
    "generalized_lesson": "Asset rollback must restore metadata identity: Include identity metadata and reference graphs in asset snapshots. Inject failure after deletion and verify references, not just content equality."
  }
}
