{
  "id": "EXP-000016",
  "title": "承認要求の保存と、承認完了の保存を分離する",
  "category": "workflows",
  "task_type": "Agent operation and authorization",
  "ai_system": "AI-assisted engineering workflow",
  "observation_date": "2026-10-09",
  "environment": "状態を永続化するエージェント、配布処理、外部操作、権限付きクリーンアップ。",
  "goal": "所有者への承認コールバックを呼ぶ前に承認済み状態を保存すると、コールバック失敗やクラッシュ後に、承認されていない操作を続行する恐れがある。",
  "approach": "まず未承認の実行意図を保存し、所有者へ承認を求め、成功を受け取ってから承認済み状態を保存する。承認済み証拠が一部失効して復旧した場合も、必要な所有者承認を取り直す。要求送信済みの印だけで再承認を抑止しない。",
  "what_worked": "本知見の効果を確かめる再現実験は未実施。候補に記載された方法は、問題の原因を切り分けるための検証設計として提案されている。",
  "what_failed": "想定される失敗モード：所有者への承認コールバックを呼ぶ前に承認済み状態を保存すると、コールバック失敗やクラッシュ後に、承認されていない操作を続行する恐れがある。",
  "why": "一般原則から追加して区別する論点：段階別の結果表示ではなく、外部承認と永続状態の食い違いによる再開時の誤実行を扱う。",
  "improved_method": "まず未承認の実行意図を保存し、所有者へ承認を求め、成功を受け取ってから承認済み状態を保存する。承認済み証拠が一部失効して復旧した場合も、必要な所有者承認を取り直す。要求送信済みの印だけで再承認を抑止しない。",
  "when_to_use": "状態を永続化するエージェント、配布処理、外部操作、権限付きクリーンアップ。",
  "when_not_to_use": "この順序だけで厳密な一回実行は保証されない。応答後の保存失敗に備え、承認操作の冪等性や重複検出も必要になる。",
  "known_limitations": "評価用の対照試験はまだ実行されていない：意図保存前、コールバック中、承認応答後の保存中に、それぞれ失敗を注入する。再起動した状態から後続の破棄・公開へ直行しないことと、再実行の重複作用を確認する。。正式レビュー日をobservation_dateとして保存しており、元事例の発生日や実験日ではない。効果の再現性と適用範囲は未確認。",
  "evidence_type": "inference",
  "reproduction_status": "not reproduced",
  "confidence": "low",
  "related_knowledge_ids": [
    "EXP-000005"
  ],
  "safety_review": {
    "status": "approved",
    "independent_review": true,
    "data_minimization": true,
    "no_identifiers": true,
    "no_private_data": true,
    "rights_checked": true
  },
  "knowledge_status": "current"
}
